{
  "format_version": 1,
  "tool": "memtest",
  "tool_version": "0.1.0",
  "timestamp": "2026-10-14T12:05:40Z",
  "git_commit": "0d92d7db85eb",
  "host": {
    "hostname": "vm",
    "kernel": "6.18.44-fc-v114",
    "cpu_model": "Intel(R) Xeon(R) Processor @ 2.10GHz",
    "logical_cpus": 4,
    "governor": null,
    "turbo": "unknown",
    "smt": "off",
    "compiler": "GCC 13.3.0",
    "compiler_flags": "-std=c++20 -O2 -DNDEBUG -Wall -Wextra -Werror",
    "build_type": "Release"
  },
  "params": {
    "size_bytes": 4036588544,
    "mem_available_bytes": 16146354176,
    "passes": 1,
    "seed": 1,
    "patterns": [
      "zeros",
      "ones",
      "checkerboard",
      "walking_ones",
      "walking_zeros",
      "address_in_address",
      "moving_inversions",
      "random"
    ],
    "inject_fault": null
  },
  "results": {
    "bytes_tested": 4036588544,
    "locked": true,
    "seconds": 204.047208283,
    "patterns": [
      {
        "name": "zeros",
        "pass": 1,
        "catches": "bits stuck at 1",
        "errors": 0,
        "seconds": 1.379362212,
        "gbs": 5.852833300612414
      },
      {
        "name": "ones",
        "pass": 1,
        "catches": "bits stuck at 0",
        "errors": 0,
        "seconds": 1.370196361,
        "gbs": 5.891985497690284
      },
      {
        "name": "checkerboard",
        "pass": 1,
        "catches": "coupling between neighbouring bits and cells",
        "errors": 0,
        "seconds": 3.011322125,
        "gbs": 5.361882092238804
      },
      {
        "name": "walking_ones",
        "pass": 1,
        "catches": "data line faults, bits stuck at 0",
        "errors": 0,
        "seconds": 93.634797486,
        "gbs": 5.518069644025801
      },
      {
        "name": "walking_zeros",
        "pass": 1,
        "catches": "data line faults, bits stuck at 1",
        "errors": 0,
        "seconds": 93.705093194,
        "gbs": 5.513930097292551
      },
      {
        "name": "address_in_address",
        "pass": 1,
        "catches": "address line faults and aliasing",
        "errors": 0,
        "seconds": 2.802452013,
        "gbs": 5.761509599843414
      },
      {
        "name": "moving_inversions",
        "pass": 1,
        "catches": "coupling faults between cells, in either direction",
        "errors": 0,
        "seconds": 4.58119264,
        "gbs": 8.811217648337093
      },
      {
        "name": "random",
        "pass": 1,
        "catches": "pattern-sensitive faults",
        "errors": 0,
        "seconds": 3.5622538,
        "gbs": 4.532623188162505
      }
    ],
    "total_errors": 0,
    "errors": [],
    "errors_truncated": false,
    "status": "pass"
  },
  "warnings": []
}
