{
  "format_version": 1,
  "tool": "perfcheck",
  "tool_version": "0.1.0",
  "timestamp": "2026-10-14T11:47:57Z",
  "git_commit": "e838faf6377c",
  "host": {
    "hostname": "vm",
    "kernel": "6.18.44-fc-v114",
    "cpu_model": "Intel(R) Xeon(R) Processor @ 2.10GHz",
    "logical_cpus": 4,
    "governor": null,
    "turbo": "unknown",
    "smt": "off",
    "compiler": "GCC 13.3.0",
    "compiler_flags": "-std=c++20 -O2 -DNDEBUG -Wall -Wextra -Werror",
    "build_type": "Release"
  },
  "params": {
    "alu_iterations": 50000000,
    "chase_bytes": 33554432,
    "chase_steps": 1000000
  },
  "results": {
    "elapsed_s": 0.260894628,
    "counters": {
      "available": false,
      "reason": "perf_event_open failed: ENOENT: event not supported here (VMs often expose no CPU PMU)"
    },
    "group_layout": [],
    "perf_stat": {
      "available": false,
      "reason": "perfctr counters unavailable: perf_event_open failed: ENOENT: event not supported here (VMs often expose no CPU PMU)"
    }
  },
  "warnings": [
    "hardware counters unavailable: perf_event_open failed: ENOENT: event not supported here (VMs often expose no CPU PMU)"
  ]
}
